{"protocol":"vad-promptless","spec_version":"0.4.0","id":"enterprise-infographic-v1","display_name":"企業資訊圖卡生成","card_kind":"skill","human_layer":{"language":"zh-TW","title":"企業資訊圖卡生成","summary":"內容重點完整、無明顯錯字、版面規格與品牌限制均符合要求","sections":[{"label":"task","items":["將輸入內容轉換成結構清楚的企業資訊圖卡"]},{"label":"input","items":["content","brand_logo"]},{"label":"process","items":["萃取目標、受眾與重點","建立標題、分區與資訊層級","檢查錯字、遺漏、品牌與格式"]},{"label":"output","items":["infographic_spec"]},{"label":"qa","items":["重點與原始資料一致","繁體中文與錯字檢查","品牌與版面限制符合"]}]},"machine_layer":{"media_type":"application/vnd.vad-promptless.card+json","encoding":"json","payload":{"schema_version":"0.3.0","card_type":"skill","id":"enterprise-infographic-v1","name":"企業資訊圖卡生成","description":"把企業文字或文件整理成繁體中文資訊圖卡規格。","language":"zh-TW","metadata":{"version":"1.0.0","author":"Promptless Skill contributors","license":"MIT","tags":["infographic","enterprise","zh-TW"]},"task":{"objective":"將輸入內容轉換成結構清楚的企業資訊圖卡","task_type":"content-design","success_definition":"內容重點完整、無明顯錯字、版面規格與品牌限制均符合要求"},"input":[{"name":"content","type":"text","required":true,"description":"原始文字或可轉成文字的資料"},{"name":"brand_logo","type":"image","required":false,"description":"品牌 Logo"}],"style":{"language":"zh-TW","tone":"專業、清楚、易讀","brand":"依輸入品牌資產","format_constraints":["預設 3:4 直式","資訊層級清楚"],"content_constraints":["不得捏造數據","繁體中文"]},"process":[{"id":"p1","name":"理解","action":"萃取目標、受眾與重點","on_failure":"human_review"},{"id":"p2","name":"結構化","action":"建立標題、分區與資訊層級","on_failure":"retry"},{"id":"p3","name":"品質檢查","action":"檢查錯字、遺漏、品牌與格式","on_failure":"retry"}],"output":{"artifacts":[{"name":"infographic_spec","type":"document","format":"markdown","required":true}],"delivery":"回傳可直接用於圖卡生成的結構化規格"},"qa":{"checks":[{"id":"q1","criterion":"重點與原始資料一致","severity":"blocker","method":"model"},{"id":"q2","criterion":"繁體中文與錯字檢查","severity":"blocker","method":"model"},{"id":"q3","criterion":"品牌與版面限制符合","severity":"warning","method":"human"}],"pass_policy":"all_blockers"},"execution":{"autonomy_level":1,"dynamic_branching":false,"dynamic_tool_selection":false,"replanning":false,"persistent_state":false,"delegation":false,"multi_agent":false,"external_side_effects":false,"human_approval_required":false,"allowed_tools":[]},"upgrade_policy":{"allow_agent_upgrade":true,"mode":"suggest","forced_reasons":[]}}},"binding":{"mode":"hybrid","carriers":["sidecar-json","png-metadata"],"metadata_key":"vad-promptless"},"integrity":{"algorithm":"sha256","canonicalization":"json-sort-keys-utf8","payload_sha256":"735fe95458366a4d96630e6411327e26e80bd3fee6cdbb753f9a1809b2f75606"},"sync":{"execution_source":"machine_layer","mismatch_policy":"human_review"}}
